,Index,Institute code,College Name,Address,Email,District,Principal Name,Office Number,Personal Number,Registrar Name
201,202,3306,"Kiran Patel Educatin Trust's Sardar Vallabhbhai Patel Polytechnic,Mumbai","I.C. Colony , Link Road Mumbai , 400101",svpp11@rediffmail.com,Mumbai City,MR. SUNNY SALL,28925045 Ext.- 118,28925029 Ext.- 118,MR. SHASHIKANT G. KHADE
202,203,3307,Nagrik Shikshan Sanstha's College of Pharmacy,"NSS Educational Complex, 'A' wing,3rd floor,94,Tardeo,Mumbai  400034",nsspharmacy165@yahoo.com,Mumbai City,Dr.(Mrs.) D.M.Desai,8976000138 Ext.- ,23524233 Ext.- ,Mrs. N.N.Tarphe
203,204,3350,"Durgadevi Saraf Institute of Management Studies, Malad (W), Mumbai","23-A, 24-28, S.V.Road, Malad (W), Mumbai 400064",c.babu@dsims.org.in,Mumbai Suburban,Dr. C Babu,45207711 Ext.- 2325, Ext.- ,Kavita Darji
204,205,3351,"Bharat College of Engineering, Kanhor, Badlapur(W)","Kanhor, Badlapur(w).,Tal- Ambernath. Dist. Thane ",info@bharatedu.co.in,Thane,Dr.S.A.Pattekari,2665001 Ext.- ,7666615915 Ext.- ,Mr. Satish Vishe
205,206,3353,"Dilkap Research Institute Of Engineering and Management Studies, At.Mamdapur, Post- Neral, Tal- Karjat,  Mumbai","Village At.Mamdapur, Post- Neral, Tal- Karjat,  Dist.Raigadh",sumaneducationaltrust@gmail.com,Raigad,DR K NARAYAN CHOUDHARY,651806 Ext.- 8,651806 Ext.- ,Mr. Jalindar Shinde
206,207,3354,"Kohinoor Business School,  Kurla (West), Mumbai","Kohinoor City, Kirol Road, Kurla West Off LBS Road Mumbai  400070",contact@kbs.ac.in,Mumbai Suburban,Dr. Abbasi Attarwala,67887700 Ext.- 736,67887700 Ext.- 725,Shraddha Joshi
207,208,3356,"Prabhakar Patil Education Society's Institute of Management Studies,Alibag, Raigad","Plot no.4&6, Survey No. 81/6 at & Post Veshvi Gondhalpada,Alibag. Raigad , 402103",ppesims@gmail.com,Raigad,Prof. Anuj Kurmar Mishra,633272 Ext.- 02141, Ext.- ,Patil Mandar Kashinath
208,209,3357,"S A V Acharya Institute of Management Studies, Shelu, Tal. Karjat","Shelu/Damat Village, Taluka Karjat, Dist Thane Raigad , 410101",director.3357savaims.mumbai@gmail.com,Raigad,Dr. Shivakant Upadhyaya,229669 Ext.- ,229668 Ext.- ,Krishna Kishore
209,210,3358,"SAS Institute of Management Studies, Boisar Dist. Thane","next to saidham complex, Saravali Boisar, Dist. Thane 401501",deep.sasinstitute@gmail.com,Palghar,Neerja Srivastava,329741 Ext.- ,264827 Ext.- ,Mrs. Sonali Hadkar
210,211,3359,"SASMIRA's Institute of Management Studies & Research, Worli, Mumbai","Sasmira Marg, Worli Mumbai - 400 030 Mumbai Mumbai , 400030",simsr@sasmira.org,Mumbai City,Dr. Tandon Kamal,24932047 Ext.- 231,24932047 Ext.- ,Mr. Sambhaji H. Kumbhar
211,212,3360,"GNVS Institute of Management, Sion-Koliwada(E), Mumbai","Guru Tegh Bahadur Nagar,Sion Koliwada (East) GTB Nagar Rly Stn(E), Mumbai",gnvsiom@gmail.com,Mumbai City,DR RAMAN KUMAR SAILY,24013273 Ext.- ,24030054 Ext.- 401,DHANESH BHURAN
212,213,3419,"Sir M Visvesvaraya Institute of Management Studies & Research, Wadala, Mumbai","7A, Wadala(W), Wadala, Mumbai. 400031",svims1@gmail.com,Mumbai City,Dr. Purshottam Patil ,24180560 Ext.- ,24180561 Ext.- ,Yatin Karbhari
213,214,3420,"Rajendra Mane Polytechnic, Devrukh, Tal. Sangmeshwar, Dist. Ratnagiri","Survey No. 50/19 & 48/10, Ambav, Devrukh, Tal. Sangmeshwar,Dist-Ratnagiri-415804",info@rmp.ind.in,Ratnagiri,Prof. Nitin B. Bhopale,269477 Ext.- ,269454 Ext.- ,PRASHANT BHINGARDE
214,215,3421,"VIVA College of Diploma Engg &Tech., At. Bolinj, Virar (W) Dist. Thane"," At. Bolinj, Virar (W) Thane , 401303",contact@vivadiploma.org,Palghar,Prof.Surendra Devidas Ghatol,7888018019 Ext.- ,9970811793 Ext.- ,MR. MAHENDRA KAJARE
215,216,3422,"New Jai Bharat Shikshan Prasarak Mandal’s Shantiniketan Polytechnic, New Panvel","Plot No. 27, Sector 2, New Panvel. Raigad ",njbspmp@gmail.com,Raigad,Prof. Nanasaheb Tambe,27460087 Ext.- ,27460089 Ext.- ,Mrs. Bakul Namdev Dighe 
216,217,3423,"Shree L.R. Tiwari College of Engineering, Mira Road, Mumbai","Survey no. 267, Near Commisioner's Bungalow,Kanakiya Park,Mira Road (E)Thane",slrtce@rahuleducation.com,Thane,Dr.S. Ram Reddy,28120144 Ext.- 209,28120145 Ext.- 209,hubale santosh
217,218,3427,"Mahatma Education Society's Pillai's HOC College of Architecture, Rasayani","Pillai's HOCL Educational Campus, Rasayani,Tal- Khalapur, Via Panvel, Dist. Raigad",phcarch@gmail.com,Raigad,MRS.SUCHITA M. SAYAJI,252005 Ext.- 111,252067 Ext.- ,Aakash Latke
218,219,3428,"Bharati Vidyapeeth Institute of Pharmacy, Belapur Navi Mumbai","Sector 8, C.B.D. Belapur, Navi Mumbai. 400614",bharatiiop@rediffmail.com,Thane,Prof. S.U. Mulla,27572131 Ext.- 501, Ext.- ,Mr. V.T. Thorat
219,220,3436,"B.R. Harne College of Engineering & Technology, Karav, Tal-Ambernath.","At.Karav, Post Vangani(w), Tal. Ambernath, Dist. Thane ",jsiddhivinayakf@gmail.com,Thane,Dr. Vikram A. Patil ,2910190 Ext.- ,2910193 Ext.- ,Shailesh
220,221,3437,"Sahyadri Institute of Management & Research, Sawarde.","Sawarde, N.H. 17, Chiplun, Dist. Ratnagiri. 415606",simrs2011@gmail.com,Ratnagiri,Miss. Ashwini Jalindar Mahadik,264025 Ext.- 02355,264025 Ext.- 02355,prakash Atmaram jadhav
221,222,3438,"Aditya Institute of Management Studies & Research, Borivali","F.P. No. 661+663+667/B, TPSIII, Ram Nagar, Borivali(W), Mumbai",info@aimsr.com,Mumbai Suburban,Dr. Sunita Srivastava,61106111 Ext.- ,61106117 Ext.- ,Seema Kedia 
222,223,3439,"Anjuman-I-Islam's Kalsekar Technical Campus, Panvel","Plot No.2, 3 Sector - 16, Khandgaon, Thane Naka, Panvel Dist. Raigad ",aiktc.newpanvel@gmail.com,Raigad,Dr. ABDUL RAZZAK HONNUTAGI,27481247 Ext.- ,27481249 Ext.- ,Dr. Jamil Daud
223,224,3440,"Metropolitan Institute of Technology & Management, Sukhalwad, Sindhudurg.","At Village Sukhalwad, Near Sindhudurg Railway Station, Post Oras, Tal. Malvan Dist. Sindhudurg",jbfmumbai@gmail.com,Sindhudurg,Suryakant C. Nawle,228553 Ext.- , Ext.- ,Rakesh Pal
224,225,3442,"Rustomjee Business School, Dahisar.","Rustom Irani Marg, Dahisar(W), Mumbai   400068",rbs@school.rustomjee.com,Mumbai Suburban,Dr. Hanif Kanjer,28937458 Ext.- ,28938348 Ext.- ,Ms. Stevina Rumao
225,226,3443,"Sheila Raheja School of Business Management & Research, Bandra(E), Mumbai.","Raheja Educational Complex, Khernagar, Opp. Colgate Ground, Bandra(E), Mumbai. 400051",admin@srbs.edu.in,Mumbai Suburban,Dr.Vijay Wagh,61966666 Ext.- 401,61966611 Ext.- ,Geeta Chauhan
226,227,3445,"Vishvatmak Jangli Maharaj Ashram Trust's Vishvatmak Om Gurudev College of Engineering, Mohili-Aghai, Shahpur.","At - Mohili, Post. Aghar, Taluka Shahapur, Dist. Thane",vishwatmakengg@gmail.com,Thane,Dr. Manojkumar Prabhakar Chavan,249001 Ext.- 217, Ext.- ,Waghmode Madan Narayan
227,228,3446,"Kala Vidyalaya Trust, Kala Institute of Management Studies & Research, Kandivali","Plot No 2,RSC 6, S.No.41(PART),Sector 8.CTS. No.3,Village Charkop Kandivali(west), Mumbai.  400067",kimms571@gmail.com,Mumbai Suburban,SHRI. V.B. PATIL,29677669 Ext.- ,28440012 Ext.- ,P.T.NALE
228,229,3447,"G.M.Vedak Institute of Technology, Tala, Raigad.","At Post Taluka. Tala, Dist. Raigad ",gmvedakit@gmail.com,Raigad,Dr.Dilip N. Jaiswal ,269004 Ext.- ,269004 Ext.- ,Prof. Satish Jadhav
229,230,3448,"Gokhale Education Society, Katgara Polytechnic Institute, Bordi.","At Post Bordi, Taluka Dhahanu, Dist. Thane  401701",katgarapolytechnic@gmail.com,Palghar,Prin. Ganesh U. Mali,254040 Ext.- ,254040 Ext.- ,Prof. Prakash K. save
230,231,3449,"S.K.Education Trust, Dr. Manoj A Shete College of Engineering & Technology, Kasara.","At Post Kasara, Tal. Shahapur, Dist. Thane ",skeducationtrust@yahoo.com,Thane,MR.RAMESH LIMBAJI SURWASE,246023 Ext.- , Ext.- ,mr.sanjay Bhalerao 
231,232,3450,"St.Wilfreds Institute of Architecture, Panvel","Survey No 92A/A Opposite Ayush Resort ,Near Shedung Tollnaka,Old Bombay Pune Highway,Panvel Dist. Raigad ",swc.mumbai@gmail.com,Raigad,Abhishek Jain, Ext.- , Ext.- ,Mukesh Soni
232,233,3451,"Lokmanya Tilak Institute of Architecture and Design Studies, Kopar Khairane, Navi Mumbai.","Sector-4, Vikas Nagar, Kopar Khairane, Navi Mumbai. ",ltiads2011@gmail.com,Thane,Prof. Harish Setty,27542441 Ext.- ,27542442 Ext.- ,Anil S. Yadav
233,234,3452,"Matoshri. Ushatai Jadhav Institute of Management studies & Research Centre, Bhivandi","Dhamankar Naka, Vidyashram, Bhivandi Thane , 421305",muimrc@gmail.com,Thane,Dr.Sopan Atmaram Bhamare,228585 Ext.- ,228585 Ext.- ,Pratiksha Manish Deolalkar
234,235,3457,"Chetana'S Institute Of Management and Research, Bandra(E), Mumbai","Survey No. 341, Govt. Colony, Bandra (E), Mumbai, - 400051",director@cimr.in,Mumbai Suburban,Dr. Madhumita Patil,62157800 Ext.- 2202,62157805 Ext.- ,Nilesh Patil
235,236,3458,"Smt. Geeta D. Tatkare Polytechnic At Gove, Kolad","At Gove, Post Kolad, Taluka Roha, Dist. Raigad.",sgdtatkarepoly@gmail.com,Raigad,VIPUL VIKAS MASAL,203020 Ext.- 02194,250101 Ext.- 02194,Mr.Ajit Raman Telange
236,237,3459,"Bunts Sangha's Uma Krishna Shetty Institute of Management Studies & Research, Kurla","Buntara Bhavan, Bhandaray Estate, Buntara Bhavan Marg, Kurla, Mumbai ",reach.uks@gmail.com,Mumbai Suburban,Dr.Krishna Shetty,24059090 Ext.- , Ext.- ,Mr. Prakash More
237,238,3460,"Universal College of Engineering,Kaman Dist. Palghar","Kaman Bhiwandi Road, S.N. 146(Part), Kaman, Vasai",moses.lopes@universal.edu.in,Palghar,Dr. Jitendra B Patil ,69624580 Ext.- ,2210044 Ext.- ,Mr. Moses Lopes
238,239,3462,"VPM's Maharshi Parshuram College of Engineering, Velneshwar, Ratnagiri.","At Post Velneshwar, Hedvai-Guhagar Road, Guhagar,Ratnagiri.",info@vpmmpcoe.org,Ratnagiri,Dr. Amitkumar T. Mane,243101 Ext.- ,9527634958 Ext.- ,Mr. Ravindra Rasal
239,240,3463,"Urja Education Society's Aditya Polytechnic, Ratnagiri","Gat No. 493, At And Post Talawade, College Road, Near Adavali Railway Station, Taluka Lanja, Dist. Ratnagiri",urja.aditya@gmail.com,Ratnagiri,SHRADDHA S. DESAI,9673963564 Ext.- ,9673963564 Ext.- ,GEETAMANJIRI S. JOSHI
240,241,3464,"Viva Institute of Pharmacy, Virar(E)","Shirgaon, Virar(E), Dist. Palghar",pharmacy@vivacollege.org,Palghar,DR SUNITA OGALE,7770002544 Ext.- 118, Ext.- ,Mr. Mahendra Kajare
241,242,3465,"Ideal Institute of Technology, Wada, Dist.Thane","40, Pasheri Village, Pimplaj road, Taluka Wada, Dist.Thane. ",idealinstituteoftechnology13@gmail.com,Palghar,Dr. Bhuwan Chandra ,212144 Ext.- 02526,212144 Ext.- 02526,Mr. Jugal Mehra 
242,243,3466,"Devi Mahalaxmi Polytechnic, Titwala, Kalyan","At Mhaskal, Near Ganesh Temple, Titwala, Kalyan. ",principal.dmpc@gmail.com,Thane,Madhukar Asre,25948752 Ext.- 022,25948752 Ext.- 022,Dr Madhukar Asre
243,244,3467,"Vishwaniketan's Institute of Management Entrepreneurship and Engineering Technology(i MEET), Khalapur Dist Raigad","Survey No. 52 Kumbhivali, On Mumbai-Pune Expressway, Near Khalapur Toll Naka ,Tal-Khalapur, Dist- Raigad",mail.vishwaniketan@gmail.com,Raigad,Dr. B. R. Patil,274206 Ext.- ,274210 Ext.- ,Mr. H. R. Mavkar
244,245,3468,"Aditya College of Architecture, Borivali (W), Mumbai","Adiya Educational Campus, R.M. Bhattad marg, Ram Nagar, Boravali (W), Mumbai",aditya.architecture@gmail.com,Mumbai Suburban,AR RITA NAYAK,61106111 Ext.- ,61106134 Ext.- ,SEEMA KEDIA
245,246,3469,"Dalvi Education and charitable trust Maharashtra Polytechnic, Soveli, Tal. Mandangad","At Shenale, Post Soveli, Tal. Mandangad, Dist Ratnagiri",kalpesh.shinde1984@gmail.com,Ratnagiri,Dinesh Bhadane, Ext.- , Ext.- ,Kalpesh Shinde
246,247,3470,"Yashwantrao Bhonsale Polytechnic, Charathe,  Sawantwadi","At Post Charathe ( Vazarwadi), Tal.Sawantwadi, Sindhudurg.",ybpolytechnic@gmail.com,Sindhudurg,Gajanan Bhosale,273535 Ext.- 30,273456 Ext.- 30,Prasad Mahale
247,248,3471,"New Horizon Institute of Technology & Management, Thane","Anand Nagar, Kavesar, Off. Ghodbunder Road, Thane(W)",principal@nhitm.ac.in,Thane,Dr. Prashant D.Deshmukh ,25971778 Ext.- ,25971778 Ext.- ,Mr. Rupesh Pethe
248,249,3472,"Thakur School of Architecture, Kandivali","Thakur Education Campus, Shamnarayan thakur marg, Thakur Village, Kandivali(E), Mumbai.",tsap@thakureducation.org,Mumbai Suburban,Prof. AR.DHIRAJ SALHOTRA,67308001 Ext.- 003, Ext.- ,Mithun Pednekar
249,250,3474,"Ideal Institute of Architecture, Posheri, Wada","Gat No. 40-1 and 2, Pimpal Road, Poseri, Tal. Wada, Dist.Thane",abhigodha431@gmail.com,Palghar,Vrushali Deshmukh,25262144 Ext.- 44, Ext.- ,Madan Lal
250,251,3475,"A. P. Shah Institute of Technology, Thane","Survey No. 12, Opp. Hypercity Mall, Kasarvadavali, Ghodbunder Road, Thane (W)",principal@apsit.org.in,Thane,Dr. Uttam D. Kolekar,25973737 Ext.- , Ext.- ,Dr. Sameer S. Nanivadekar
251,252,3477,"Chhartrapati Shivaji Maharaj Institute of Technology, Shedung, Panvel","92A/1, Old Mumbai Pune Highway, Near Shedung Toll naka Village Shedung, Panvel, Dist Raigad",csmit.mah@gmail.com,Raigad,Abhishek Jain, Ext.- , Ext.- ,Mukesh Soni
252,253,3478,"CTES College of Architecture, Chembur, Mumbai.","N.G. Acharya Marg, Chembur, Mumbai.",principal@ctescoa.com,Mumbai Suburban,Alka Tawari,25217343 Ext.- 257,25217343 Ext.- 257,Supriya Mantri
253,254,3479,"Shivgiita Institute of Diploma in Pharmacy, Asangaon.","Opp. Asangaon Railway Station, Asangaon, Dist.Thane",vjtsscoe@rediffmail.com,Thane,Prof. Sunayana Ghodgaonkar,273999 Ext.- ,271399 Ext.- ,kalpana londhe 
254,255,3480,"Yashwantrao Bhonsale College of Pharmacy, A/P Charathe, Sawantwadi","Buidling No.2, A/P Charathe, Vazarwadi, Tal.Sawantwadi, Dist.Sindhudurg",ybpharmacy@gmail.com,Sindhudurg,Dr. Jagtap Vijay A.,272299 Ext.- ,272233 Ext.- ,Prasad K. Mahale
255,256,3481,"The Navkonkan Education Society's Institute of Management Studies, Chiplun","S.K.Patil Nagar, Mumbai Goa High way, Chiplun, Dist.Ratnagiri",neimschiplun@gmail.com,Ratnagiri,Dr.Anagha Gokhale,253043 Ext.- , Ext.- ,Vijay Sawant
256,257,3482,"B.R. Harne College of Architecture, Karav, Vangani(W)","AT Village Karav, Vangani(West), Dist Thane ",brharnecoa@gmail.com,Thane,Mr. Uday Keshav More, Ext.- , Ext.- ,MR. VAMAN YADAV
257,258,3483,"Vishwaniketan College of Architecture, Art & Design, Khalapur","Survey No. 52, Kumbhivali Near Khalapur Toll Naka, off Mumbai-Pune, Expressway, Khalapur, Raigad",vcaad@vishwaniketan.edu.in,Raigad,Suchetha Mathew,2192274206 Ext.- , Ext.- ,Manoj Anandrao Suryavanshi
258,259,3484,"Smt. K.L. Tiwari College of Architecture, Nalasopara, Palghar","Survey No. 185, 177, Near Mother Merry English School, Shri Prastha, Nalasopara, Dist Palghar",kantiltiwari1@gmail.com,Palghar,Mrs. Rupali H.Gupte,8007916355 Ext.- ,9975626257 Ext.- ,Mr. Santosh Hubale
259,260,3485,"St. Wilfred's Institute of Pharmacy, Panvel","old Mumbai-Pune Highway Near Shedoung Toll plaza, Raigad",swc.mumbai@gmail.com,Raigad,Abhishek Jain,2143239091 Ext.- , Ext.- ,MukeshSoni
260,261,3486,"Shree Saraswati Institute of Pharmacy, At Post Tondavali, Kankavali","At Post Tondavali, Nandgaon-Ponda road, Taluka Kankavali, Dist.Sindhudurg",shreesaraswatipharmacy@gmail.com,Sindhudurg,Kedar Tukaram Kisan,248589 Ext.- ,0 Ext.- ,Nikhil Vasant Sawant
261,262,3487,"Ideal Institute of Pharmacy, Wada","Ideal Foundation, Wada, Taluka Wada, District Palghar",idealpharmacy3487@gmail.com,Palghar,Dr. Umesh latyan,0222526214 Ext.- , Ext.- ,MR. LOKESH VYAS
262,263,3488,"School of Environment and Architecture, Borivali","Eksar Road, Borivali(west), Mumbai.",contact@sea.edu.in,Mumbai Suburban,Ravindra Punde, Ext.- , Ext.- ,Dipti Bhaindarkar
263,264,3489,"Yashwantrao Bhonsale College of D. Pharmacy, Charathe Vazarwadi","Building NO.4, A/P Charathe Vazarwadi, Taluka Sawantwadi, Dist Sindhudurg",ybdpharmacy@gmail.com,Sindhudurg,Mr. Tushar G. Rukari,272251 Ext.- , Ext.- ,Prasad K. Mahale
264,265,3490,"VP College of Pharmacy, Madkhol, Sawantwadi","Gut No.286, At Post Madkhol, Taluka Sawantwadi, Dist Sindhudurg",vpcpm2017@gmail.com,Sindhudurg,Dr. Sunil Shingade,246670 Ext.- ,246770 Ext.- ,Mr Pankaj Patil
265,266,3492,"SBNM College of Pharmacy(D.Pharmacy), Mahad","Gut No.311 & 313, Achloli, Mahad, Raigad",sbnm.cop@gmail.com,Raigad,Mr. Kamble Subodh Vishnukant,9970166872 Ext.- ,8600494586 Ext.- ,Mr. Kamble Subodh Vishnukant
266,267,3493,"Shri Angarsiddha Shikshan Prasarak Mandal's ASPM College of Pharmacy, Sangulwadi","At Post Sangulwadi, Tal Vaibhavwadi, Dist. Sindhudurg",aspmpharmacy@gmail.com,Sindhudurg,Sudhakar Yeole,237270 Ext.- 02367,237270 Ext.- 02367,Sandeep Patil
267,268,3494,"Smt. Jayshree Sharadchandra Kothari Business School, Dadar, Mumbai","DES Mumbai Campus, Kirti College Road, Veer Savarkar Marg, Mumbai",office.jskbs@despune.org,Mumbai City,Dr. Rasika Mallya,62764554 Ext.- ,62764551 Ext.- ,Shridhar Chougule
268,269,3495,"Vasantdada Patil Pratishthan's Manohar Phalke College of Architecture, Sion-Chunabhatti, Mumbai","Vasantdada Patil Educational Complex, Eastern Express Highway, Sion-Chunabhatti, Mumbai.",sheetalckamble@gmail.com,Mumbai City,Ar. Surendra C. Rane,20847227 Ext.- ,20847227 Ext.- ,SHEETAL CHANDRAKANT KAMBLE
269,270,3496,"Vivekanand Education Society's  College of Architecture, Chembur, Mumbai","Hashu Advani Memorial Complex, Behind Collector Colony, R.C. Marg, Chembur, Mumbai",,Mumbai Suburban,Shri Anand Achari , Ext.- , Ext.- ,MRS.ROSHNI MORE
270,271,3497,"S.K. Education Trust's Dr. Manoj A. Shete College of Architecture,  Kasara","At post Kasara, Taluka  Shahapur, Dist.Thane",manojpchavan@gmail.com,Thane,Dr. Manojkumar Chavan,8108000534 Ext.- , Ext.- ,yogeshwari hardas
271,272,3498,"Sasmiras Business School, Worli, Mumbai","Sasmira Marg Worli Mumbai - 400030 , Mumbai, Mumbai City , Maharashtra 400030",sbs@sasmira.org,Mumbai City,Dr. Sanskruti Kadam,24935351 Ext.- 231, Ext.- ,Sambhaji Kumbhar
272,273,3499,"M.S. College Of Pharmacy, Devghar","Sy. No. 120, Devghar,  Taluka : Wada Dist: Palghar, Thane",mscollegeofpharmacy2019@gmail.com,Palghar,MR. LOKESH VYAS, Ext.- , Ext.- ,MR. SAMEER KHAN
273,274,3500,"Vijayrao Naik College Of  Pharmacy, Shirval","A/P Shirval, Tal-Kankavli, Dist. Sindhudurg",vncop19@gmail.com,Sindhudurg,Dr. Supriya R. Hyam, Ext.- , Ext.- ,Mr. Mandar Trimbak Sawant
274,275,3501,"Siddhis Institute Of Pharmacy, Nandgaon",At.Post Nandgaon Tal. Murbad Dist  Thane,principal.siddhi@gmail.com,Thane,Pachpute T S,8408035769 Ext.- ,7666548761 Ext.- ,Santosh Deshmukh
275,276,3503,"Indala College Of Engineering, Bapsai Tal.Kalyan","Near Hp Gagangiri Petrol Pump, Kalyan-Murbad Road, Bapsai, Taluka Kalyan, Dist Thane ",icoekalyan1@gmail.com,Thane,Dr. C.M. CHOUDHARI,2973456 Ext.- , Ext.- ,Prof. ATUL ZOPE
276,277,3504,"Raigad College Of Pharmacy, Mohopre","Mohopre, Tal. Mahad, Dist. Raigad",raigadcop@gmail.com,Raigad,MR. TANGADE AMOL RAMCHANDRA,8956972859 Ext.- ,9970166872 Ext.- ,ARUN UTTAMRAO DEVRE
277,278,3505,"Abhinav Institute Of Pharmacy, Chinchpada","4/3 B Chinchpada,, Taluka Ambernath, District Thane",abhinavinstituteofpharmacy@gmail.com,Thane,ANURADHA BHUSHANKUMAR SAKHARE,2250455 Ext.- 0251,9850442188 Ext.- ,S.K. TRIPATHI
278,279,3506,"Shri. Pandit Baburao Chaughule College Of Pharmacy, Rahanal","At/Po. Rahanal, Anjur Phata, Jakat Naka, Bhiwandi",spbc.pharmacy@gmail.com,Thane,SHRI INDRAPAL BABURAO CHAUGHULE, Ext.- , Ext.- ,Dr. Vinayak Dahiwale
279,280,3507,"Indala School of Architechture, Bapsai Tal.Kalyan","Near Hp Gagangiri Petrol Pump, Kalyan-Murbad Road, Bapsai, Kalyan  421301",isoakalyan1@gmail.com,Thane,DR. SHASHANK NINAWE, Ext.- , Ext.- ,Prof. ATUL NARKHEDE
280,281,3508,"B.K. Patil Institute of Pharmacy, Taloja, Panvel","Shiv Mandir, Taloja, Taluka Panvel Dist.Raigad",kghpss.2019@gmail.com,Raigad,Mrs.Iniya Madhan kumaar,0222742464 Ext.- ,9987118533 Ext.- ,VIJAY DNYANOBA KAKEKAR
